{
  "schema_version": "event_card_large_current_v2_case.v1",
  "case_id": "event-card-large-portrait-poster-8156-mobile-390",
  "component_id": "event.card",
  "lifecycle_status": "active_ready",
  "contract_sha256": "dfc49a54ebd9a4d2d9da1f9c24321abf349714c62d3abf1dd00f71c1ce63ae1e",
  "design_sha": "0882917a1328607c498d82e4c2a652bbd3df946d",
  "astro_sha": "22ebe3c5e92b13684cca32c14357ef7b91834977",
  "events_tooling_sha": "713a035a8aaa9ecfdcdd5fbd817fe504160df2f5",
  "corpus_sha256": "9ca2960fb8d723f95b19c012b50f8abb5e4503eedcf673fe178ed0f4afd46320",
  "fixture_id": "event.real.8156",
  "fixture_sha256": "c2c4eaf7e9e88c89de7e4f510143237668073faf6dd07a36df65afa344b0518a",
  "fixture_snapshot_sha256": "5ff3be3ce417145f97b4b5c5a2d315fd820acf0ba5d222ea282523d04500adf1",
  "asset_manifest_sha256": "3819811e9598a65e03a2a4467672c5e836142c6fd6c3a21178b644fe0dff6953",
  "resolved_case_sha256": "ec88be884f1eaff70b45c2035254b1da63f30011b80d9914003ab1698b5d8274",
  "resolved_case_path": "resolved/event-card-large-portrait-poster-8156-mobile-390.resolved.json",
  "viewport": {
    "id": "mobile-390",
    "width": 390,
    "height": 1100,
    "container_width": 390,
    "parent_container_width": null,
    "device_scale_factor": 1
  },
  "state_key": "viewport=mobile-390;layout=split-actions;presentation=dark-shell;media=loaded-protected;fixture=event.real.8156;consumer=standalone-flow",
  "current_penpot_structural_readback": {
    "status": "verified_found",
    "file_revision": 1408,
    "page_id": "7f078c80-87b8-80f5-8008-859071466c42",
    "shape_id": "7f078c80-87b8-80f5-8008-8590c3e3ca48",
    "facts_sha256": "2b99e6470247330c90919cb481757688440f54569ff27584c49b90f19302f6a3",
    "facts_path": "penpot-readback/event-card-large-portrait-poster-8156-mobile-390.facts.json"
  },
  "penpot_binding": {
    "binding_status": "bound",
    "file_id": "3be9e5e1-190f-8090-8008-713c0fbe6260",
    "page_id": "7f078c80-87b8-80f5-8008-859071466c42",
    "shape_id": "7f078c80-87b8-80f5-8008-8590c3e3ca48",
    "revision": 1409,
    "export_revision_status": "verified_exact",
    "metadata_readback_revision": 1410,
    "historical_materialization_label": "EventCard Large mobile portrait 390 · exact same-data natural 2:3 · candidate.15",
    "export_sha256": "d35f6ee9c606a14d5df61bef9979d347a2edeb05bc3df58d16355dc6d98cc2fb",
    "contract_sha256": "dfc49a54ebd9a4d2d9da1f9c24321abf349714c62d3abf1dd00f71c1ce63ae1e",
    "metadata_readback_status": "verified_current_v2",
    "cache_key_sha256": "9e02e90c00dd9281ffa83df7baaa457b1cca66ec1a9e9624fe2aed2a28c840d4",
    "cache_tuple": {
      "file_id": "3be9e5e1-190f-8090-8008-713c0fbe6260",
      "page_id": "7f078c80-87b8-80f5-8008-859071466c42",
      "shape_id": "7f078c80-87b8-80f5-8008-8590c3e3ca48",
      "revision": 1409,
      "export_revision_status": "verified_exact",
      "contract_sha256": "dfc49a54ebd9a4d2d9da1f9c24321abf349714c62d3abf1dd00f71c1ce63ae1e",
      "resolved_case_sha256": "ec88be884f1eaff70b45c2035254b1da63f30011b80d9914003ab1698b5d8274"
    },
    "board_or_component_id": "7f078c80-87b8-80f5-8008-8590c3e3ca48",
    "font_manifest_sha256": "622ccd047f4f761f45ec047734db83348d2955fb1e1b01b63fc8f6a3b0d3b160"
  },
  "astro_binding": {
    "binding_status": "source_bound_captured",
    "repository_sha": "22ebe3c5e92b13684cca32c14357ef7b91834977",
    "route": "/specimens/event-card-large-portrait-poster-8156-mobile-390/",
    "root_selector": "[data-event-card]",
    "candidate_package_sha": "22ebe3c5e92b13684cca32c14357ef7b91834977"
  },
  "evidence_status": "durable_pack_verified",
  "evidence_manifest_path": "../../../../../evidence/ui-conformance/event-card-large/current/v2/event-card-large-portrait-poster-8156-mobile-390/durable-evidence-manifest.json",
  "contract_version": "event-card-large.current-v2.1",
  "authority_mode": "astro-reference",
  "conformance_profile": "pixel-strict",
  "container_width": 390,
  "corpus_id": "ui-reference-events.v1",
  "fixture_mode": "blocking-golden",
  "event_title": "Выставка «Мой город»",
  "expected_candidate_deltas": [],
  "viewport_id": "mobile-390",
  "viewport_width": 390,
  "viewport_height": 1100,
  "device_scale_factor": 1,
  "resolved_render_case_sha256": "ec88be884f1eaff70b45c2035254b1da63f30011b80d9914003ab1698b5d8274",
  "fixture_source": "events/event.real.8156.json"
}
