{
  "schema_version": "event_card_large_current_v2_case.v1",
  "case_id": "event-card-large-ocr-protected-4327-desktop",
  "component_id": "event.card",
  "lifecycle_status": "active_blocked",
  "contract_sha256": "dfc49a54ebd9a4d2d9da1f9c24321abf349714c62d3abf1dd00f71c1ce63ae1e",
  "design_sha": "0882917a1328607c498d82e4c2a652bbd3df946d",
  "astro_sha": "22ebe3c5e92b13684cca32c14357ef7b91834977",
  "events_tooling_sha": "713a035a8aaa9ecfdcdd5fbd817fe504160df2f5",
  "corpus_sha256": "9ca2960fb8d723f95b19c012b50f8abb5e4503eedcf673fe178ed0f4afd46320",
  "fixture_id": "event.real.4327",
  "fixture_sha256": "c032e42d5fa020e587c3909e11396e1f0aafb37d28da433324bdd33c796a2734",
  "fixture_snapshot_sha256": "5ff3be3ce417145f97b4b5c5a2d315fd820acf0ba5d222ea282523d04500adf1",
  "asset_manifest_sha256": "3819811e9598a65e03a2a4467672c5e836142c6fd6c3a21178b644fe0dff6953",
  "resolved_case_sha256": "1fe5e2b8a5cd73d9426eb5e56252f738fd828f3142f366d57f81d84f8e736ef7",
  "resolved_case_path": "resolved/event-card-large-ocr-protected-4327-desktop.resolved.json",
  "viewport": {
    "id": "desktop-1280",
    "width": 1280,
    "height": 900,
    "container_width": 380,
    "parent_container_width": 1180,
    "device_scale_factor": 1
  },
  "state_key": "viewport=desktop;layout=split-actions;presentation=dark-shell;media=loaded-protected;fixture=event.real.4327",
  "current_penpot_structural_readback": {
    "status": "verified_found",
    "file_revision": 1408,
    "page_id": "579a886e-56e8-80a3-8008-81882dbcfb6d",
    "shape_id": "b0fe69fd-ccaf-8025-8008-84710768100c",
    "facts_sha256": "bf77f27a2435f8b1bed7a9e946a3c4622c4919c67e5a737ce380a51ae2ae75c9",
    "facts_path": "penpot-readback/event-card-large-ocr-protected-4327-desktop.facts.json"
  },
  "penpot_binding": {
    "binding_status": "bound",
    "file_id": "3be9e5e1-190f-8090-8008-713c0fbe6260",
    "page_id": "579a886e-56e8-80a3-8008-81882dbcfb6d",
    "shape_id": "b0fe69fd-ccaf-8025-8008-84710768100c",
    "revision": 1316,
    "export_revision_status": "verified_exact",
    "metadata_readback_revision": 1408,
    "historical_materialization_label": null,
    "export_sha256": "2827216bc7c3328d687eb139a1a822e95698b07594961e6a89fcb561652ef41f",
    "contract_sha256": "dfc49a54ebd9a4d2d9da1f9c24321abf349714c62d3abf1dd00f71c1ce63ae1e",
    "metadata_readback_status": "blocked_requires_current_v2_verified_readback",
    "cache_key_sha256": "d680db73c30e0226a7a74555ac4cd95dbecca19506a4eb9f31339f62b290bbac",
    "cache_tuple": {
      "file_id": "3be9e5e1-190f-8090-8008-713c0fbe6260",
      "page_id": "579a886e-56e8-80a3-8008-81882dbcfb6d",
      "shape_id": "b0fe69fd-ccaf-8025-8008-84710768100c",
      "revision": 1316,
      "export_revision_status": "verified_exact",
      "contract_sha256": "dfc49a54ebd9a4d2d9da1f9c24321abf349714c62d3abf1dd00f71c1ce63ae1e",
      "resolved_case_sha256": "1fe5e2b8a5cd73d9426eb5e56252f738fd828f3142f366d57f81d84f8e736ef7"
    }
  },
  "astro_binding": {
    "binding_status": "source_bound_capture_blocked",
    "repository_sha": "22ebe3c5e92b13684cca32c14357ef7b91834977",
    "route": "/specimens/event-card-large-ocr-protected-4327-desktop/",
    "root_selector": "[data-event-card]"
  },
  "evidence_status": "blocked_missing_durable_pack",
  "evidence_manifest_path": "../../../../../../evidence/ui-conformance/event-card-large/current-v2/event-card-large-ocr-protected-4327-desktop/durable-evidence-manifest.json"
}
